{
  "$schema": "/adventure-maker/adventure.schema.json",
  "title": "Verführung zur Entführung",
  "version": 1,
  "author": "Oliver Eickenberg (1997)",
  "description": "Ein Gruppenabenteuer in Aventurien (DSA). Mitten in Gareth wird die einzige Tochter des Händlers Arberd Vronfelden scheinbar entführt — oder ist mehr im Spiel? Geeignet als Einstiegsabenteuer (>100 AP für ersten Stufenanstieg). Spielzeit: ca. ein Abend.",
  "startLocationId": "start",
  "content": {
    "initialState": {},
    "locations": [
      {
        "id": "start",
        "title": "Zentraler Platz im Handelsviertel",
        "generalInfo": "Der Marktplatz liegt inmitten der Kaiserstadt und ist der Herzpunkt aller Aktivitäten. Er wird von einem großen, prächtigen Brunnen dominiert, der mit Figuren aus Bronze geschmückt ist. Die Wasserstrahlen des Brunnens springen aufwärts in einem bunten Spiel aus Licht und Wasser, beleuchtet durch das sanfte Licht, das von den umliegenden Gebäuden reflektiert wird. Um den Marktplatz herum stehen prachtvolle Gebäude, in denen sich luxuriöse Geschäfte, Gasthöfe und sogar das königliche Amt befinden\n\nDer Platz ist ein Treffpunkt für alle Schichten der Gesellschaft. An den Ständen des Marktes bietet man alles vom frischesten Obst und Gemüse bis hin zu hochwertigen Edelsteinen an. Die Atmosphäre ist lebendig, mit dem Läuten von Glöckchen bei jedem neuen Kauf, den Gesang der Händlerinnen beim Verkauf ihrer Waren und das Gelächter des Volksgeschehens.",
        "specialInfo": "",
        "masterInfo": "",
        "onEnter": [],
        "onExit": [],
        "transitions": [
          {
            "to": "e5815fa0-1885-46a1-b477-ea5ddcee04e2"
          },
          {
            "to": "91b35e74-cca1-41c3-89b5-119a3194d757"
          },
          {
            "to": "0bd69e14-713c-4c65-ab28-898eb9d4a381"
          }
        ],
        "items": [],
        "persons": []
      },
      {
        "id": "e5815fa0-1885-46a1-b477-ea5ddcee04e2",
        "title": "Taverne zum tanzenden Stier",
        "generalInfo": "",
        "specialInfo": "",
        "masterInfo": "",
        "onEnter": [],
        "onExit": [],
        "transitions": [
          {
            "to": "start"
          }
        ],
        "items": [],
        "persons": []
      },
      {
        "id": "91b35e74-cca1-41c3-89b5-119a3194d757",
        "title": "Waffenladen zur Eiserne Jungfrau",
        "generalInfo": "Die Eiserne Jungfrau befindet sich in einem kleinen, aber gut gepflegten Gebäude mit schwarzem Fachwerk und einem steilen Dach aus roten Ziegeln. Über der Tür prangt ein wunderschönes Schild mit dem Bild einer Jungfrau, die einen Schwert schmiedet. Die Fenster sind mit Eisenbarren gesichert und die Tür selbst ist stark und gut verriegelt.\n\nAls du in den Laden gehst, bemerkst du sofort die Vielfalt an Waffen und Rüstungen, die von den Wänden bis zum Boden reichen. Es riecht nach Schmiedehitze, Öl und Metall. Du wirst von Angrella selbst begrüßt, einer erfahrenen und ehrbaren Schmiedin mit einem warmen Lächeln.\n\nDer Laden bietet eine breite Palette an Waffen und Rüstungen ",
        "specialInfo": "Die Preise sind deutlich höher als in den Provinzen, aber die Qualität ist durchwegs gut!",
        "masterInfo": "",
        "onEnter": [],
        "onExit": [],
        "transitions": [
          {
            "to": "start"
          }
        ],
        "items": [],
        "persons": [
          {
            "personId": "b21f41a3-ed03-4883-a33f-96e2c43c488c"
          }
        ]
      },
      {
        "id": "0bd69e14-713c-4c65-ab28-898eb9d4a381",
        "title": "Taverne Weisser Walfisch",
        "generalInfo": "Die Taverne ist ein alter Steinbau mit einem spitzen Dach und einer großen Eingangstür, über der das Wappen eines weissen Wals in schwarzem Holz prangt. Drinnen herrscht eine gemütliche Atmosphäre: die Mauern sind mit Fellen tapeziert, die Tische sind von Lampen beleuchtet und die Luft ist dick von dem Duft von Bratfleisch und Bier. Der Wirt selbst, ein gutmütiger Mann namens Gundolf, bedient seine Gäste gerne mit einem Lächeln und einer Geschichte, sobald er Zeit dazu findet.",
        "specialInfo": "An der Theke sitzt Bjoern Skaldottir, er weiss wer der gesuchte Vater ist.\nDer Wirt weiss auch, wer der verzweifelte Vater ist.",
        "masterInfo": "",
        "onEnter": [],
        "onExit": [],
        "transitions": [
          {
            "to": "start"
          }
        ],
        "items": [],
        "persons": [
          {
            "personId": "3c7fd726-8d77-4bb0-950f-eb22aaa2f443"
          },
          {
            "personId": "aa5f1044-f47c-4dd5-8dca-761a2aa28b6f"
          }
        ]
      }
    ],
    "persons": [
      {
        "id": "b21f41a3-ed03-4883-a33f-96e2c43c488c",
        "name": "Angrella der Schmiedin",
        "generalInfo": "Angrella, die ehrgeizige und fachkundige Schmiedin, sie führt die Schmiede zur eisenen Jungfrau. Mit ihren mächtigen Armen und ihrer unermüdlichen Arbeitsweise ist sie bekannt für ihre Meisterstücke: scharfe Klingen, stabile Speere und glühende Öfen. Ihre Leidenschaft für das Feuer und die Metallarbeit hat sie zu einer der respektiertesten Handwerkerinnen der Kaiserstadt Gareth gemacht.",
        "specialInfo": "",
        "masterInfo": ""
      },
      {
        "id": "a78d8f06-9988-4d2e-8b7f-60ff3fccf312",
        "name": "Romosch der Wirt",
        "generalInfo": "Romosch, Sohn des Gramlon, ein Zwerg den es nach drei erfolglosen Brautwerbung ins menschliche Singledasein verschlagen hat.",
        "specialInfo": "Er kennt den neuesten Klatsch und Tratsch wobei seine grössten Interessen dem Schmiedehandwerk gelten. Und Angrella die Schmiedin im Norden der Stadt soll einen Zweihänder erschaffen haben, diese langen Schwerter mit denen nur die Riesen umgehen können.",
        "masterInfo": ""
      },
      {
        "id": "3c7fd726-8d77-4bb0-950f-eb22aaa2f443",
        "name": "Bjoern Skaldottir",
        "generalInfo": "Bjoern Skaldottir, Thorwaler, Gast im weissen Walfisch, weiss, dass der verzweifelte Vater Arberd Vronfelden ist und einen Laden in GarethHandelsplatz hat.",
        "specialInfo": "Er besucht seine Schwester, Haggard Skaldottir, die demnächst heiraten will.",
        "masterInfo": ""
      },
      {
        "id": "aa5f1044-f47c-4dd5-8dca-761a2aa28b6f",
        "name": "Gundolf Attermen",
        "generalInfo": "Gundolf Attermen, Wirt des weissen Walfisch, weiss, dass der verzweifelte Vater Arberd Vronfelden ist und einen Laden in GarethHandelsplatz hat.",
        "specialInfo": "er verkauft einen vorzüglichen Wein",
        "masterInfo": ""
      },
      {
        "id": "7bdc680b-0198-405c-8ee3-5392c5d6ab8c",
        "name": "Arberd Vronfelden",
        "generalInfo": "",
        "specialInfo": "",
        "masterInfo": ""
      }
    ],
    "items": [],
    "flags": [
      {
        "id": "walk_to_tavern",
        "description": "",
        "initialValue": false
      },
      {
        "id": "party_bonus",
        "description": "",
        "initialValue": false
      },
      {
        "id": "await_arberds_intro",
        "description": "",
        "initialValue": false
      },
      {
        "id": "brawling_bonus",
        "description": "",
        "initialValue": false
      },
      {
        "id": "escape_the_brawl",
        "description": "",
        "initialValue": false
      },
      {
        "id": "found_arberds_address",
        "description": "",
        "initialValue": false
      },
      {
        "id": "ready_to_visit_arberds",
        "description": "",
        "initialValue": false
      }
    ],
    "questbook": {
      "mainQuest": {
        "title": "Verführung zur Entführung",
        "description": "Mitten in Gareth liegt der kleine Kontor des Händlers Arberd Vronfelden, der Schauplatz eines Verbrechens werden wird: Die Entführung seiner einzigen Tochter Irva. Während die Büttel der Kaiserstadt vergeblich bemüht sind, sowohl Täter als auch Opfer zu finden, können die Helden versuchen, das Rätsel zu lösen — und sollen dafür reich belohnt werden."
      },
      "quests": [
        {
          "id": "7a91e163-860f-4db0-b231-08d76123afdb",
          "title": "Ein Abend in der Taverne",
          "generalInfo": "Die Helden wollen am Abend in Gareth in eine Taverne gehen - es ist Zeit, dass sich die Helden auch endlich mal wieder amüsierern. Das Abenteuer beginnt auf dem Marktplatz von Gareth",
          "specialInfo": "Das Abenteuer beginnt Nachmittags und falls die Helden vorher noch Einkäufe tätigen oder andere Erledigungen machen wollen, ist noch genug Zeit sich in der Kaiserstadt Gareth umzusehen.\n\nWenn die Helden die Bewohner der Stadt fragen, welche Taverne die beste ist, wird ihnen die Taverne zum tanzenden Stier genannt",
          "masterInfo": "",
          "completionCondition": {
            "flag": "walk_to_tavern",
            "equals": true
          },
          "tasks": [
            {
              "id": "95d7b00f-3914-4e65-9986-4eca8f73c600",
              "description": "besucht die Taverne \"zum tanzenden Ochsen\""
            }
          ]
        },
        {
          "id": "5ce0f5a5-a9d4-467a-bfc8-85019aab6aff",
          "title": "die Taverne zum Tanzenden Stier",
          "generalInfo": "Als Ihr die Tür zu der Taverne öffnen wollt kommt mit dieser gleich der erste betrunkenen Gast mit aus der brechend vollen Taverne heraus gepurzelt. Er flucht ein paar unverständliche Worte, faßt sich nachdem er sich hochgerappelt hat an den breiten Schädel und wankt von dannen nicht ohne vorher noch ein paarmal an die Hauswand angetitscht zu sein. Die Taverne scheint kaum noch Platz für euch frei zu haben. Da die Stimmung die nach außen dringt aber wirklich fröhlich ist wollt Ihr auch rein zu den Garether Trunkenbolden. ",